{
  "$schema": "https://github.com/MarkEdit-app/extensions/raw/refs/heads/main/schemas/theme.schema.json",
  "id": "markedit-theme-noctis-lilac",
  "name": "Noctis Lilac Theme",
  "description": "A light theme with a lilac background, from the Noctis family.",
  "author": "MarkEdit-app",
  "homepage": "https://github.com/MarkEdit-app/MarkEdit-theme-noctis-lilac",
  "colorScheme": "light",
  "colorPatterns": [
    "#f2f1f8,#0c006b,#fa8900,#ff5792,#00b368,#9995b7"
  ],
  "versions": [
    {
      "version": "1.1.0",
      "url": "https://raw.githubusercontent.com/MarkEdit-app/MarkEdit-theme-noctis-lilac/v1.1.0/dist/markedit-theme-noctis-lilac.js",
      "sha256": "684fe5830f715820f125dc06f851cde2ef7eacb58c1de3cd5e0bd5030a9d576f"
    },
    {
      "version": "1.0.0",
      "url": "https://raw.githubusercontent.com/MarkEdit-app/MarkEdit-theme-noctis-lilac/v1.0.0/dist/markedit-theme-noctis-lilac.js",
      "sha256": "2813adad175d5e1fa4eeefdea65fc458ab8605204c5598bc1f90f149d8be7e22"
    }
  ]
}
