{
  "$schema": "https://github.com/MarkEdit-app/extensions/raw/refs/heads/main/schemas/theme.schema.json",
  "id": "markedit-theme-red-graphite",
  "name": "Red Graphite",
  "description": "A light MarkEdit theme with rose accents and graphite text.",
  "author": "unsnruu",
  "homepage": "https://github.com/unsnruu/markedit-red-graphite",
  "colorScheme": "light",
  "colorPatterns": [
    "#fcfcfc,#222222,#e06e73,#a74e5c,#687647,#858585"
  ],
  "versions": [
    {
      "version": "1.0.0",
      "url": "https://github.com/unsnruu/markedit-red-graphite/releases/download/v1.0.0/markedit-theme-red-graphite.js",
      "sha256": "a4fc0671fa306a3178e14efb39aed7d7df1a1469b1e8fe38b9c2f413e44d387a",
      "minAppVersion": "1.37.0",
      "notes": "Initial light theme release."
    }
  ]
}
