{
  "$schema": "https://github.com/MarkEdit-app/extensions/raw/refs/heads/main/schemas/theme.schema.json",
  "id": "markedit-theme-gruvbox",
  "name": "Gruvbox Theme",
  "description": "A retro groove color scheme, warm and high-contrast.",
  "author": "MarkEdit-app",
  "homepage": "https://github.com/MarkEdit-app/MarkEdit-theme-gruvbox",
  "featured": true,
  "colorScheme": "both",
  "colorPatterns": [
    "#fbf1c7,#3c3836,#79740e,#9d0006,#076678,#928374",
    "#282828,#ebdbb2,#b8bb26,#fb4934,#076678,#928374"
  ],
  "versions": [
    {
      "version": "1.1.0",
      "url": "https://raw.githubusercontent.com/MarkEdit-app/MarkEdit-theme-gruvbox/v1.1.0/dist/markedit-theme-gruvbox.js",
      "sha256": "a4ec67d8828caa049b9a9ea6016d8307a1c81ade0ad82eb3dbb16ccb15e2769a",
      "notes": "Upgrade markedit-theming to latest."
    },
    {
      "version": "1.0.0",
      "url": "https://raw.githubusercontent.com/MarkEdit-app/MarkEdit-theme-gruvbox/v1.0.0/dist/markedit-theme-gruvbox.js",
      "sha256": "d2abe83583370c16d47d4cc27f61ec96fc65fce7c093b5913f72b2a1bcc8cdd4"
    }
  ]
}
