{
  "$schema": "https://github.com/MarkEdit-app/extensions/raw/refs/heads/main/schemas/theme.schema.json",
  "id": "markedit-theme-basic",
  "name": "Basic Theme",
  "description": "Minimal colors with soft accents.",
  "author": "MarkEdit-app",
  "homepage": "https://github.com/MarkEdit-app/MarkEdit-theme-basic",
  "colorScheme": "both",
  "colorPatterns": [
    "#ffffff,#2e3440,#5e81ac,#8fbcbb,#d08770,#434c5e",
    "#2e3235,#dddddd,#5e81ac,#8fbcbb,#6fb3d2,#808080"
  ],
  "versions": [
    {
      "version": "1.1.0",
      "url": "https://raw.githubusercontent.com/MarkEdit-app/MarkEdit-theme-basic/v1.1.0/dist/markedit-theme-basic.js",
      "sha256": "fcc16b6c5aab8cbb82934ea023fa064d409e7950fbd9d24c3086f14d21836c53"
    },
    {
      "version": "1.0.0",
      "url": "https://raw.githubusercontent.com/MarkEdit-app/MarkEdit-theme-basic/v1.0.0/dist/markedit-theme-basic.js",
      "sha256": "36aa2857372dff13b5d6c2fd0f36f3fea9efb14b6742fa3e9d7a28cc966951ee"
    }
  ]
}
