{
  "$schema": "https://github.com/MarkEdit-app/extensions/raw/refs/heads/main/schemas/theme.schema.json",
  "id": "markedit-theme-nord",
  "name": "Nord Theme",
  "description": "An arctic, north-bluish color palette.",
  "author": "MarkEdit-app",
  "homepage": "https://github.com/MarkEdit-app/MarkEdit-theme-nord",
  "colorScheme": "dark",
  "colorPatterns": [
    "#2e3440,#d8dee9,#5e81ac,#8fbcbb,#a3be8c,#4c566a"
  ],
  "versions": [
    {
      "version": "1.1.0",
      "url": "https://raw.githubusercontent.com/MarkEdit-app/MarkEdit-theme-nord/v1.1.0/dist/markedit-theme-nord.js",
      "sha256": "6030e533a0bcce69b49c4862d38dfc93e3e58d5f10c52ebb92f0916997543f52"
    },
    {
      "version": "1.0.0",
      "url": "https://raw.githubusercontent.com/MarkEdit-app/MarkEdit-theme-nord/v1.0.0/dist/markedit-theme-nord.js",
      "sha256": "ab6ba9fb2bd78685db1e01d89186e8e721a59401fe0544b929b0fcec750590fa"
    }
  ]
}
