{
  "$schema": "https://github.com/MarkEdit-app/extensions/raw/refs/heads/main/schemas/theme.schema.json",
  "id": "markedit-theme-duotone",
  "name": "DuoTone Theme",
  "description": "Only two hues, with emphasis on what matters.",
  "author": "MarkEdit-app",
  "homepage": "https://github.com/MarkEdit-app/MarkEdit-theme-duotone",
  "colorScheme": "both",
  "colorPatterns": [
    "#faf8f5,#b29762,#2d2006,#063289,#1659df,#b6ad9a",
    "#2a2734,#6c6783,#eeebff,#ffcc99,#ffb870,#cdcbd3"
  ],
  "versions": [
    {
      "version": "1.1.0",
      "date": "2026-07-31T05:00:00Z",
      "url": "https://raw.githubusercontent.com/MarkEdit-app/MarkEdit-theme-duotone/v1.1.0/dist/markedit-theme-duotone.js",
      "sha256": "74c777e5873edfee6d2e526289d1ce0876078d8fb943e8420fc43357f134d9e3",
      "notes": "Upgrade markedit-theming to latest."
    },
    {
      "version": "1.0.0",
      "date": "2026-07-09T14:00:00Z",
      "url": "https://raw.githubusercontent.com/MarkEdit-app/MarkEdit-theme-duotone/v1.0.0/dist/markedit-theme-duotone.js",
      "sha256": "f1b1e8773292a87efd13ae5b291efcbda4daef87fa752279f22a1251a876875e",
      "notes": "Initial release."
    }
  ]
}
