{
  "$schema": "https://github.com/MarkEdit-app/extensions/raw/refs/heads/main/schemas/theme.schema.json",
  "id": "markedit-theme-tokyo-night",
  "name": "Tokyo Night Theme",
  "description": "Celebrates the lights of downtown Tokyo at night.",
  "author": "MarkEdit-app",
  "homepage": "https://github.com/MarkEdit-app/MarkEdit-theme-tokyo-night",
  "colorScheme": "both",
  "colorPatterns": [
    "#e1e2e7,#3760bf,#b15c00,#007197,#587539,#848cb5",
    "#1a1b26,#787c99,#89ddff,#bb9af7,#9ece6a,#444b6a"
  ],
  "versions": [
    {
      "version": "1.1.0",
      "url": "https://raw.githubusercontent.com/MarkEdit-app/MarkEdit-theme-tokyo-night/v1.1.0/dist/markedit-theme-tokyo-night.js",
      "sha256": "329ca79666cc6dddf5ef7c9def49919758d4f280c6bb968033dd105c3a5220bc",
      "notes": "Upgrade markedit-theming to latest."
    },
    {
      "version": "1.0.0",
      "url": "https://raw.githubusercontent.com/MarkEdit-app/MarkEdit-theme-tokyo-night/v1.0.0/dist/markedit-theme-tokyo-night.js",
      "sha256": "82f4b0724c654d9aa5270f444a5e39cf887da3f7c1d18d45db69bd31c5496de6"
    }
  ]
}
